{
    "dataset": {
        "path": "unspecified",
        "name": "unspecified",
        "uuid": "unspecified",
        "size-go": 0.0,
        "file-number": "unspecified",
        "last-modification-date": "unspecified"
    },
    "data": {
        "protection-level": "NP",
        "source": "reanalysis-era5-single-levels",
        "source-url": "https://cds.climate.copernicus.eu/api/v2/",
        "download-date": "2024-06-10 06:20:16",
        "format-reference": "netcdf",
        "data-license": "https://cds.climate.copernicus.eu/api/v2/terms/static/licence-to-use-copernicus-products.pdf",
        "license-doi": "10.24381/cds.adbb2d47",
        "license-quote": "Generated using Copernicus Climate Change Service information 2024 and/or generated using Copernicus Atmosphere Monitoring Service Information 2024Hersbach, H., Bell, B., Berrisford, P., Biavati, G., Horányi, A., Muñoz Sabater, J., Nicolas, J., Peubey, C., Radu, R., Rozum, I., Schepers, D., Simmons, A., Soci, C., Dee, D., Thépaut, J-N. (2023): ERA5 hourly data on single levels from 1940 to present. Copernicus Climate Change Service (C3S) Climate Data Store (CDS), DOI: 10.24381/cds.adbb2d47 (Accessed on 10-06-2024). Neither the European Commission nor ECMWF is responsible for any use that may be made of the Copernicus information or data it contains.",
        "time-range": {
            "start": "unspecified",
            "end": "unspecified"
        }
    },
    "checksums-reference": "unspecified",
    "datapaper-reference": "unspecified",
    "releasenotes-reference": "unspecified",
    "rgpd": "unspecified",
    "restrictions": "unspecified",
    "verification-results": {
        "fair-results": {
            "findable": {
                "metadata-values": "unspecified",
                "uuid-value": "unspecified"
            },
            "accessible": "unspecified",
            "interoperable": "unspecified",
            "reusable": "unspecified"
        },
        "other-results": {
            "plausibility": "unspecified",
            "consistency": "unspecified",
            "coherence": "unspecified"
        }
    }
}